{
  "schema_version": "2.0",
  "mode": "single_run",
  "status": "systematic",
  "code_version": "0.8.0",
  "repository": "https://github.com/Strobo-Travels-Deep/root",
  "source_paper": {
    "journal": "Phys. Rev. A 109, 053105 (2024)",
    "doi": "10.1103/PhysRevA.109.053105",
    "arxiv": "2309.15580"
  },
  "endorsement_marker": "Local candidate framework",
  "execution": {
    "timestamp": "2026-03-23T13:56:43.393919+00:00",
    "engine": "python-scipy",
    "precision": "float64",
    "elapsed_s": 28.83
  },
  "provenance_hash": "e0e08de1f44a5fdd0c956fb68fb3cd83778148f5795e09c394ae0a116613010f",
  "payload": {
    "parameters": {
      "alpha": 5,
      "alpha_phase_deg": 0.0,
      "eta": 0.397,
      "omega_m": 1.3,
      "omega_r": 0.3,
      "n_thermal": 0.0,
      "n_thermal_traj": 1,
      "nmax": 40,
      "squeeze_r": 0.0,
      "squeeze_phi_deg": 0.0,
      "theta_deg": 0.0,
      "phi_deg": 0.0,
      "det_min": -6,
      "det_max": 6,
      "npts": 201,
      "n_pulses": 22,
      "t_sep_factor": 1.0,
      "T1": 0.0,
      "T2": 0.0,
      "heating": 0.0,
      "n_traj": 1,
      "n_rep": 0
    },
    "derived": {
      "omega_eff": 0.2772661775729955,
      "debye_waller": 0.9242205919099851,
      "n_mean": 25,
      "hilbert_dim": 80
    },
    "convergence": {
      "max_fock_leakage": 0.011108766279919826,
      "converged": false
    },
    "data": {
      "detuning": [
        -6.0,
        -5.94,
        -5.88,
        -5.82,
        -5.76,
        -5.7,
        -5.64,
        -5.58,
        -5.52,
        -5.46,
        -5.4,
        -5.34,
        -5.28,
        -5.22,
        -5.16,
        -5.1,
        -5.04,
        -4.98,
        -4.92,
        -4.86,
        -4.8,
        -4.74,
        -4.68,
        -4.62,
        -4.5600000000000005,
        -4.5,
        -4.4399999999999995,
        -4.38,
        -4.32,
        -4.26,
        -4.2,
        -4.140000000000001,
        -4.08,
        -4.02,
        -3.96,
        -3.9,
        -3.84,
        -3.7800000000000002,
        -3.72,
        -3.66,
        -3.6,
        -3.54,
        -3.48,
        -3.42,
        -3.3600000000000003,
        -3.3000000000000003,
        -3.24,
        -3.18,
        -3.12,
        -3.06,
        -3.0,
        -2.94,
        -2.88,
        -2.8200000000000003,
        -2.7600000000000002,
        -2.7,
        -2.64,
        -2.58,
        -2.52,
        -2.46,
        -2.4000000000000004,
        -2.3400000000000003,
        -2.2800000000000002,
        -2.22,
        -2.16,
        -2.1,
        -2.04,
        -1.9800000000000004,
        -1.92,
        -1.8600000000000003,
        -1.7999999999999998,
        -1.7400000000000002,
        -1.6799999999999997,
        -1.62,
        -1.5600000000000005,
        -1.5,
        -1.4400000000000004,
        -1.38,
        -1.3200000000000003,
        -1.2599999999999998,
        -1.2000000000000002,
        -1.1400000000000006,
        -1.08,
        -1.0200000000000005,
        -0.96,
        -0.9000000000000004,
        -0.8399999999999999,
        -0.7800000000000002,
        -0.7200000000000006,
        -0.6600000000000001,
        -0.6000000000000005,
        -0.54,
        -0.4800000000000004,
        -0.41999999999999993,
        -0.3600000000000003,
        -0.2999999999999998,
        -0.2400000000000002,
        -0.1800000000000006,
        -0.1200000000000001,
        -0.0600000000000005,
        0.0,
        0.05999999999999961,
        0.1200000000000001,
        0.17999999999999972,
        0.2400000000000002,
        0.2999999999999998,
        0.35999999999999943,
        0.41999999999999993,
        0.47999999999999954,
        0.54,
        0.5999999999999996,
        0.6600000000000001,
        0.7199999999999998,
        0.7799999999999994,
        0.8399999999999999,
        0.8999999999999995,
        0.96,
        1.0199999999999996,
        1.08,
        1.1399999999999997,
        1.1999999999999993,
        1.2599999999999998,
        1.3199999999999994,
        1.38,
        1.4399999999999995,
        1.5,
        1.5599999999999996,
        1.62,
        1.6799999999999997,
        1.7399999999999993,
        1.7999999999999998,
        1.8599999999999994,
        1.92,
        1.9799999999999995,
        2.039999999999999,
        2.0999999999999996,
        2.16,
        2.219999999999999,
        2.2799999999999994,
        2.34,
        2.4000000000000004,
        2.459999999999999,
        2.5199999999999996,
        2.58,
        2.6400000000000006,
        2.6999999999999993,
        2.76,
        2.8200000000000003,
        2.879999999999999,
        2.9399999999999995,
        3.0,
        3.0600000000000005,
        3.119999999999999,
        3.1799999999999997,
        3.24,
        3.299999999999999,
        3.3599999999999994,
        3.42,
        3.4800000000000004,
        3.539999999999999,
        3.5999999999999996,
        3.66,
        3.719999999999999,
        3.7799999999999994,
        3.84,
        3.9000000000000004,
        3.959999999999999,
        4.02,
        4.08,
        4.139999999999999,
        4.199999999999999,
        4.26,
        4.32,
        4.379999999999999,
        4.4399999999999995,
        4.5,
        4.559999999999999,
        4.619999999999999,
        4.68,
        4.74,
        4.799999999999999,
        4.859999999999999,
        4.92,
        4.98,
        5.039999999999999,
        5.1,
        5.16,
        5.219999999999999,
        5.279999999999999,
        5.34,
        5.4,
        5.459999999999999,
        5.52,
        5.58,
        5.639999999999999,
        5.699999999999999,
        5.76,
        5.82,
        5.879999999999999,
        5.9399999999999995,
        6.0
      ],
      "sigma_x": [
        0.005495395309744321,
        -0.00577252749219374,
        -0.020885025879524878,
        -0.037043097707046446,
        -0.05118920256600276,
        -0.06059268101273548,
        -0.06338410505270611,
        -0.05893450562933707,
        -0.04800316299210398,
        -0.03262062987756366,
        -0.015723937176009797,
        -0.000608998372364483,
        0.009698195543755186,
        0.013032179442124335,
        0.008525758775827345,
        -0.003192864080825874,
        -0.020086987787365496,
        -0.039072062977572715,
        -0.05658692064865787,
        -0.06927043999445401,
        -0.07461579352877681,
        -0.07147571738726663,
        -0.06031789932833052,
        -0.04317520336083845,
        -0.023292779530213553,
        -0.004532429040639224,
        0.009357244076925154,
        0.015467836739021953,
        0.01231530111811352,
        0.00016507633578077314,
        -0.0189712559982386,
        -0.041675999705880665,
        -0.06374583605169791,
        -0.08098119484313622,
        -0.0899974408034967,
        -0.08890253096422393,
        -0.07770703169615908,
        -0.05837987861820365,
        -0.034528674191487876,
        -0.010754660901695879,
        0.008203662269647041,
        0.018380384903615293,
        0.01737252302579187,
        0.004855381822839873,
        -0.017284812752795517,
        -0.04523901617375083,
        -0.07394300504345588,
        -0.09800947778096657,
        -0.11275518191530094,
        -0.11512973977275913,
        -0.10436492979345341,
        -0.08221012964735007,
        -0.05269370043446348,
        -0.021438178857523856,
        0.0053569345510484975,
        0.022083555605852047,
        0.024827731319249417,
        0.012193947079929546,
        -0.014317279543395765,
        -0.050468930571683585,
        -0.08997660336659538,
        -0.12561927871282652,
        -0.1505796948649411,
        -0.15977079786706777,
        -0.15089676849715025,
        -0.12503586977201114,
        -0.08661247280398122,
        -0.042733900951904484,
        -0.0019852752410592627,
        0.027118992479625664,
        0.03775497422415173,
        0.026181622670487438,
        -0.007365679301775547,
        -0.058473639179366044,
        -0.11911760835142376,
        -0.17893546096389978,
        -0.22701589248423765,
        -0.2539045266286606,
        -0.2534758589861505,
        -0.22432404131944966,
        -0.17039253880472455,
        -0.10068255647049891,
        -0.028033938609580672,
        0.032865565324237594,
        0.0679441633084327,
        0.06628701874893367,
        0.02232462951101044,
        -0.06272297821843584,
        -0.18043155163034158,
        -0.31591405111146126,
        -0.44965884731142114,
        -0.5602223260531973,
        -0.6273843481861962,
        -0.6352853734195002,
        -0.575050403900623,
        -0.44647131926988776,
        -0.25845650179799456,
        -0.028143808464952055,
        0.22121971065864576,
        0.4633337983989009,
        0.6723897653016047,
        0.8265770977053339,
        0.9110276043604433,
        0.919758104097485,
        0.8563270527601379,
        0.733119206426887,
        0.5693834612208115,
        0.3883385590668299,
        0.21379926586772677,
        0.06684041622881627,
        -0.03700151006783087,
        -0.08958571028268689,
        -0.09083732688366378,
        -0.04817725323386883,
        0.025146265237702713,
        0.11251486228007737,
        0.19676448440229943,
        0.26291467486475717,
        0.30037566112540753,
        0.30430936058693975,
        0.27597227251316003,
        0.22204208647993262,
        0.1530961793244611,
        0.08154165187583645,
        0.019372563456960087,
        -0.02386004001197291,
        -0.042534929163885196,
        -0.035682422887213544,
        -0.006860342256896957,
        0.03674796376924807,
        0.08581545262745265,
        0.13064473388818376,
        0.16290815590849314,
        0.17705139057510855,
        0.17113064000540618,
        0.1469638943170153,
        0.10960312493814259,
        0.06625406616367975,
        0.024862508748503348,
        -0.007364390128124794,
        -0.025233478077591652,
        -0.02641735752109229,